{
  "schema_version": "1.0.0",
  "trust_record_id": "SYN-TRUST-001",
  "issuer_or_source_ref": "SYN-IDENTITY-PROVIDER-001",
  "evidence_format": "API_ATTESTATION",
  "claim_types": [
    "identity_proofing"
  ],
  "trust_scope": [
    "synthetic-test-only"
  ],
  "jurisdiction_scope": [
    "SYN-CHAIN-US-CA"
  ],
  "profile_state": "REFERENCE_ONLY",
  "official_source_refs": [
    "SYN-SOURCE-001"
  ],
  "reviewed_at": "2026-09-22T20:00:00Z",
  "effective_at": null,
  "expires_at": null,
  "revocation_ref": null,
  "endorsed": false
}
